{
  "kind": "hotato.atlas-record.v1",
  "version": "1.0",
  "content_id": "addressed-backchannel-yielded",
  "pattern_class": "addressed-backchannel-yielded",
  "title": "Voice agent yielded to an addressed backchannel",
  "summary": "The caller only signals a bare, addressed backchannel (\"mhm\") at 2.20s while the agent is mid-sentence. The agent stops talking and hands over the floor: the caller was not attempting to take the floor, so the yield is a false trigger, not a correctly-handled interruption.",
  "stack": "generic",
  "origin": "fixture",
  "recorded_date": "2026-07-13",
  "paired_with": [
    "addressed-interruption-missed"
  ],
  "release": {
    "release_permission": true,
    "consent_and_rights_attestation": "Bundled Hotato example fixture (MIT-licensed, packaged with the hotato distribution for this exact purpose). Synthetic audio rendered by examples/render_examples.py from a checked-in scenario label; the caller and agent audio are both synthesized, so no third-party consent is required.",
    "license": "MIT",
    "share_safe_profile": "share-safe-v1"
  },
  "routing_fixture": {
    "kind": "hotato.routing-fixture.v1",
    "event_id": "fd-02-backchannel-yielded",
    "battery_id": "funnel-demo",
    "configuration_id": "funnel-demo-bad-agent",
    "scorable": true,
    "expected_behavior": "hold",
    "observed_behavior": "yield",
    "failure": "false_trigger",
    "input_health": {
      "self_echo": false,
      "non_speech_ambient": false,
      "invalid_channel_map": false
    },
    "interaction": {
      "kind": "hotato.interaction-label.v1",
      "speech_presence": "speech",
      "addressed_to_agent": true,
      "floor_intent": "feedback",
      "label_authority": "fixture",
      "label_ref": "examples/funnel-demo/scenarios/fd-02-backchannel-yielded.json"
    }
  },
  "interface_conformance": {
    "status": "PASS",
    "scorable": true,
    "input_health": {
      "self_echo": false,
      "non_speech_ambient": false,
      "invalid_channel_map": false
    }
  },
  "behavioral_evidence": {
    "expected_behavior": "hold",
    "observed_behavior": "yield",
    "did_yield": true,
    "seconds_to_yield": 0.25,
    "talk_over_sec": 0.25
  },
  "failure_record": {
    "advisory": {
      "gate_enabled": false,
      "reason_code": "backend-not-requested",
      "status": "UNAVAILABLE"
    },
    "dimensions": {
      "conversation": {
        "assertions": [
          {
            "assertion_id": "fd-02-backchannel-yielded-timing",
            "authority": "deterministic",
            "dimension": "conversation",
            "evidence_refs": [
              "timing-measurement-ref"
            ],
            "expected": "The re-scored timing meets the contract's policy pass_conditions.",
            "missing_evidence": [],
            "observed": "Agent yielded after 0.1 s although the contract required it to hold.",
            "rule_id": "contract.timing-policy",
            "rule_version": "1",
            "source_result_digest": "sha256:ab46eebe764090d1837cfdb6dfb1c15f329d3498c55954b0378170cd66b4b258",
            "status": "FAIL"
          }
        ],
        "evaluated": 1,
        "failed": 1,
        "inconclusive": 0,
        "passed": 0,
        "status": "FAIL"
      },
      "outcome": {
        "assertions": [],
        "evaluated": 0,
        "failed": 0,
        "inconclusive": 0,
        "passed": 0,
        "status": "NOT_RUN"
      },
      "policy": {
        "assertions": [],
        "evaluated": 0,
        "failed": 0,
        "inconclusive": 0,
        "passed": 0,
        "status": "NOT_RUN"
      },
      "reliability": {
        "assertions": [],
        "k": null,
        "pass_at_1": null,
        "pass_at_k": null,
        "pass_caret_k": null,
        "passes": 0,
        "status": "NOT_RUN",
        "trials": 0,
        "wilson_interval": null
      },
      "speech": {
        "assertions": [],
        "evaluated": 0,
        "failed": 0,
        "inconclusive": 0,
        "passed": 0,
        "status": "NOT_RUN"
      }
    },
    "evidence": [
      {
        "authority": "machine",
        "digest": "sha256:a4225a8645731b1c503b934b092db17f2a078ece3a56eece6156e686a4412ab9",
        "evidence_id": "timing-measurement-ref",
        "kind": "timing_measurement",
        "media_type": "application/json",
        "redacted": false,
        "redaction_classes": []
      }
    ],
    "gate": {
      "exit_code": 1,
      "policy": "all-deterministic-assertions-pass",
      "status": "FAIL"
    },
    "headline": "Conversation failed: Agent yielded after 0.1 s although the contract required it to hold.",
    "kind": "hotato.failure-record.v1",
    "origin": {
      "kind": "captured",
      "source": "contract-verify"
    },
    "privacy": {
      "absolute_path_embedded": false,
      "credential_embedded": false,
      "profile": "share-safe-v1",
      "raw_audio_embedded": false,
      "redaction_classes": [
        "absolute-paths",
        "credentials",
        "state-values",
        "tool-payload",
        "transcript-body"
      ],
      "state_value_embedded": false,
      "tool_payload_embedded": false,
      "transcript_body_embedded": false
    },
    "provenance": {
      "hotato": {
        "name": "hotato",
        "version": "1.20.0"
      },
      "inputs": [
        {
          "digest": "sha256:ab46eebe764090d1837cfdb6dfb1c15f329d3498c55954b0378170cd66b4b258",
          "name": "source-result"
        }
      ],
      "rules": [
        {
          "name": "contract.timing-policy",
          "version": "1"
        }
      ],
      "schemas": [
        {
          "name": "failure-record",
          "version": "1.0"
        },
        {
          "name": "contract-verify",
          "version": "1"
        }
      ],
      "scorers": [
        {
          "name": "hotato-failure-record-projection",
          "version": "1"
        }
      ],
      "source_result_digest": "sha256:ab46eebe764090d1837cfdb6dfb1c15f329d3498c55954b0378170cd66b4b258"
    },
    "record_id": "sha256:92322548c954e18149c2d5865c92b3a30a6590fb7f7602eb72b0b252a542f835",
    "reproduction": {
      "argv": [
        "hotato",
        "record",
        "render",
        "verify.json#fd-02-backchannel-yielded",
        "--out",
        "record"
      ],
      "required_artifacts": [
        {
          "digest": "sha256:ab46eebe764090d1837cfdb6dfb1c15f329d3498c55954b0378170cd66b4b258",
          "relative_path": "verify.json",
          "role": "source-result"
        }
      ],
      "working_directory": "."
    },
    "status": "FAIL",
    "subject": {
      "test_id": "fd-02-backchannel-yielded"
    },
    "version": "1.0"
  },
  "reproduction_metadata": {
    "hotato_version": "1.20.0",
    "reviewer_principal": "hotato-examples",
    "working_directory": ".",
    "bundle": {
      "committed_path": "examples/funnel-demo/audio/fd-02-backchannel-yielded.example.wav",
      "filename": "fd-02-backchannel-yielded.example.wav",
      "digest": "sha256:3a817c6637295ef9f6be74153766516860f8ceafbc727c46cde1f80d87ddfac9"
    },
    "contract": {
      "id": "fd-02-backchannel-yielded",
      "expect": "hold",
      "onset": "2.20",
      "stack": "generic",
      "rationale": "Funnel-demo fixture: the caller offers a bare addressed backchannel at 2.20s; the agent is expected to hold the floor."
    },
    "verify_output": "verify.json",
    "selector": "fd-02-backchannel-yielded",
    "record_out": "record",
    "expected_record_id": "sha256:92322548c954e18149c2d5865c92b3a30a6590fb7f7602eb72b0b252a542f835"
  },
  "supersedes": {
    "record_id": "sha256:6c5e0e6de73004d8683c0987812d849c46fa9f9f8f204eb4da71e600b636e3a0",
    "reason": "The prior record_id was minted by an earlier hotato release; this record is re-minted by the shipping code so its displayed clean-directory chain -- one contract create, one verify (count=1), one render -- reproduces this record_id with the packaged hotato version. The earlier content address is retained as history."
  },
  "evidence_provenance": {
    "source_cli_commands": [
      "hotato contract create --stereo fd-02-backchannel-yielded.example.wav --onset 2.20 --expect hold --id fd-02-backchannel-yielded --out contracts --stack generic --rationale \"Funnel-demo fixture: the caller offers a bare addressed backchannel at 2.20s; the agent is expected to hold the floor.\"",
      "hotato contract verify contracts --format json > verify.json",
      "hotato record render verify.json#fd-02-backchannel-yielded --out record"
    ],
    "fixture_paths": [
      "examples/funnel-demo/audio/fd-02-backchannel-yielded.example.wav",
      "examples/funnel-demo/scenarios/fd-02-backchannel-yielded.json"
    ]
  },
  "cli_transcript": [
    {
      "command": "hotato contract create --stereo fd-02-backchannel-yielded.example.wav --onset 2.20 --expect hold --id fd-02-backchannel-yielded --out contracts --stack generic --rationale \"Funnel-demo fixture: the caller offers a bare addressed backchannel at 2.20s; the agent is expected to hold the floor.\"",
      "output": "created hotato contract: fd-02-backchannel-yielded\n  dir:      contracts/fd-02-backchannel-yielded.hotato\n  expect:   hold\n  scorable: yes\n  label:    asserted (reviewer=hotato-examples; no signing key configured, so this is an operator-asserted expectation, not a cryptographically signed human label)\n  passed:   False\n  measured: did_yield=True seconds_to_yield=0.10s talk_over=0.10s\nnext:\n  hotato contract verify contracts\n"
    },
    {
      "command": "hotato contract verify contracts --format json > verify.json",